{
  "$schema": "https://json-schema.org/draft/2020-12/schema",
  "$id": "urn:aces-scenario-pack:schema:compatibility:v0",
  "version": "0.1.0",
  "title": "ACES Scenario Pack — Compatibility (v0)",
  "description": "A pack's declared ACES SDL and pack-version compatibility and the compatibility boundary it claims. Implements 'Compatibility Boundaries' in contracts/scenario-pack-contract.md and does not encode a downstream consumer's deployment matrix, branch rules, labels, or workflow states.",
  "type": "object",
  "required": ["packId", "packVersion", "sdlContractVersion", "boundary"],
  "properties": {
    "packId": {"type": "string", "description": "Pack this compatibility declaration applies to."},
    "packVersion": {"type": "string", "description": "Pack version (SemVer) this declaration applies to."},
    "sdlContractVersion": {"type": "string", "description": "ACES SDL contract version the pack is compatible with."},
    "boundary": {
      "type": "object",
      "description": "The declared line between what the pack owns and what ACES core or a downstream consumer owns.",
      "required": ["owns", "dependsOn"],
      "properties": {
        "owns": {
          "type": "array",
          "description": "Pack-native concepts this pack owns.",
          "items": {"type": "string"}
        },
        "dependsOn": {
          "type": "array",
          "description": "Concepts owned by ACES core or elsewhere that the pack depends on.",
          "items": {"type": "string"}
        }
      }
    },
    "breakingChangePolicy": {"type": "string", "description": "How breaking change is reasoned about for this pack (see docs/versioning.md)."}
  }
}
